{
  "id": "healing-buds-video-hero-v1",
  "name": "Healing Buds Video Hero",
  "version": "1.0.0",
  "author": "HB Design Team",
  "description": "Immersive full-screen video hero with parallax scrolling, modern medical cannabis aesthetic, and smooth scroll animations.",
  "preview_image": "/templates/healing-buds-video-hero/preview.jpg",
  "tags": ["video", "parallax", "modern", "medical", "immersive"],
  "category": "medical",
  "created_at": "2025-11-24",
  "updated_at": "2025-11-24",
  "compatibility": {
    "platform_version": "2.0+",
    "nextjs_version": "14.x",
    "react_version": "18.x",
    "requires_features": ["hero-video", "consultation-booking"]
  },
  "features": {
    "hero_video": true,
    "parallax_scrolling": true,
    "scroll_animations": true,
    "dark_mode": false,
    "multi_language": false
  },
  "performance": {
    "lighthouse_score": 92,
    "bundle_size_kb": 145,
    "load_time_ms": 1800
  },
  "accessibility": {
    "wcag_level": "AA",
    "screen_reader_tested": true,
    "keyboard_navigable": true
  },
  "pricing": {
    "type": "free",
    "price_usd": 0
  },
  "support": {
    "documentation_url": "https://docs.budstack.io/templates/healing-buds-video-hero",
    "demo_url": "https://demo.budstack.io/templates/healing-buds-video-hero"
  }
}
